{
  "shard_id": "shard-1",
  "agent": "generic-maintainability",
  "candidate_findings": [
    {
      "id": "cf-1",
      "path": "src/foo.ts",
      "line": 11,
      "side": "RIGHT",
      "severity": "low",
      "confidence": "medium",
      "category": "style",
      "title": "Finding 1",
      "evidence": "evidence 1",
      "impact": "impact 1",
      "suggestion": "suggestion 1",
      "introduced_by_pr": true,
      "source_agent": "generic-maintainability"
    },
    {
      "id": "cf-2",
      "path": "src/foo.ts",
      "line": 12,
      "side": "RIGHT",
      "severity": "low",
      "confidence": "medium",
      "category": "style",
      "title": "Finding 2",
      "evidence": "evidence 2",
      "impact": "impact 2",
      "suggestion": "suggestion 2",
      "introduced_by_pr": true,
      "source_agent": "generic-maintainability"
    },
    {
      "id": "cf-3",
      "path": "src/foo.ts",
      "line": 13,
      "side": "RIGHT",
      "severity": "low",
      "confidence": "medium",
      "category": "style",
      "title": "Finding 3",
      "evidence": "evidence 3",
      "impact": "impact 3",
      "suggestion": "suggestion 3",
      "introduced_by_pr": true,
      "source_agent": "generic-maintainability"
    },
    {
      "id": "cf-4",
      "path": "src/foo.ts",
      "line": 14,
      "side": "RIGHT",
      "severity": "low",
      "confidence": "medium",
      "category": "style",
      "title": "Finding 4",
      "evidence": "evidence 4",
      "impact": "impact 4",
      "suggestion": "suggestion 4",
      "introduced_by_pr": true,
      "source_agent": "generic-maintainability"
    },
    {
      "id": "cf-5",
      "path": "src/foo.ts",
      "line": 15,
      "side": "RIGHT",
      "severity": "low",
      "confidence": "medium",
      "category": "style",
      "title": "Finding 5",
      "evidence": "evidence 5",
      "impact": "impact 5",
      "suggestion": "suggestion 5",
      "introduced_by_pr": true,
      "source_agent": "generic-maintainability"
    },
    {
      "id": "cf-6",
      "path": "src/foo.ts",
      "line": 16,
      "side": "RIGHT",
      "severity": "low",
      "confidence": "medium",
      "category": "style",
      "title": "Finding 6",
      "evidence": "evidence 6",
      "impact": "impact 6",
      "suggestion": "suggestion 6",
      "introduced_by_pr": true,
      "source_agent": "generic-maintainability"
    },
    {
      "id": "cf-7",
      "path": "src/foo.ts",
      "line": 17,
      "side": "RIGHT",
      "severity": "low",
      "confidence": "medium",
      "category": "style",
      "title": "Finding 7",
      "evidence": "evidence 7",
      "impact": "impact 7",
      "suggestion": "suggestion 7",
      "introduced_by_pr": true,
      "source_agent": "generic-maintainability"
    },
    {
      "id": "cf-8",
      "path": "src/foo.ts",
      "line": 18,
      "side": "RIGHT",
      "severity": "low",
      "confidence": "medium",
      "category": "style",
      "title": "Finding 8",
      "evidence": "evidence 8",
      "impact": "impact 8",
      "suggestion": "suggestion 8",
      "introduced_by_pr": true,
      "source_agent": "generic-maintainability"
    },
    {
      "id": "cf-9",
      "path": "src/foo.ts",
      "line": 19,
      "side": "RIGHT",
      "severity": "low",
      "confidence": "medium",
      "category": "style",
      "title": "Finding 9",
      "evidence": "evidence 9",
      "impact": "impact 9",
      "suggestion": "suggestion 9",
      "introduced_by_pr": true,
      "source_agent": "generic-maintainability"
    },
    {
      "id": "cf-10",
      "path": "src/foo.ts",
      "line": 20,
      "side": "RIGHT",
      "severity": "low",
      "confidence": "medium",
      "category": "style",
      "title": "Finding 10",
      "evidence": "evidence 10",
      "impact": "impact 10",
      "suggestion": "suggestion 10",
      "introduced_by_pr": true,
      "source_agent": "generic-maintainability"
    },
    {
      "id": "cf-11",
      "path": "src/foo.ts",
      "line": 21,
      "side": "RIGHT",
      "severity": "low",
      "confidence": "medium",
      "category": "style",
      "title": "Finding 11",
      "evidence": "evidence 11",
      "impact": "impact 11",
      "suggestion": "suggestion 11",
      "introduced_by_pr": true,
      "source_agent": "generic-maintainability"
    },
    {
      "id": "cf-12",
      "path": "src/foo.ts",
      "line": 22,
      "side": "RIGHT",
      "severity": "low",
      "confidence": "medium",
      "category": "style",
      "title": "Finding 12",
      "evidence": "evidence 12",
      "impact": "impact 12",
      "suggestion": "suggestion 12",
      "introduced_by_pr": true,
      "source_agent": "generic-maintainability"
    },
    {
      "id": "cf-13",
      "path": "src/foo.ts",
      "line": 23,
      "side": "RIGHT",
      "severity": "low",
      "confidence": "medium",
      "category": "style",
      "title": "Finding 13",
      "evidence": "evidence 13",
      "impact": "impact 13",
      "suggestion": "suggestion 13",
      "introduced_by_pr": true,
      "source_agent": "generic-maintainability"
    },
    {
      "id": "cf-14",
      "path": "src/foo.ts",
      "line": 24,
      "side": "RIGHT",
      "severity": "low",
      "confidence": "medium",
      "category": "style",
      "title": "Finding 14",
      "evidence": "evidence 14",
      "impact": "impact 14",
      "suggestion": "suggestion 14",
      "introduced_by_pr": true,
      "source_agent": "generic-maintainability"
    },
    {
      "id": "cf-15",
      "path": "src/foo.ts",
      "line": 25,
      "side": "RIGHT",
      "severity": "low",
      "confidence": "medium",
      "category": "style",
      "title": "Finding 15",
      "evidence": "evidence 15",
      "impact": "impact 15",
      "suggestion": "suggestion 15",
      "introduced_by_pr": true,
      "source_agent": "generic-maintainability"
    },
    {
      "id": "cf-16",
      "path": "src/foo.ts",
      "line": 26,
      "side": "RIGHT",
      "severity": "low",
      "confidence": "medium",
      "category": "style",
      "title": "Finding 16",
      "evidence": "evidence 16",
      "impact": "impact 16",
      "suggestion": "suggestion 16",
      "introduced_by_pr": true,
      "source_agent": "generic-maintainability"
    },
    {
      "id": "cf-17",
      "path": "src/foo.ts",
      "line": 27,
      "side": "RIGHT",
      "severity": "low",
      "confidence": "medium",
      "category": "style",
      "title": "Finding 17",
      "evidence": "evidence 17",
      "impact": "impact 17",
      "suggestion": "suggestion 17",
      "introduced_by_pr": true,
      "source_agent": "generic-maintainability"
    },
    {
      "id": "cf-18",
      "path": "src/foo.ts",
      "line": 28,
      "side": "RIGHT",
      "severity": "low",
      "confidence": "medium",
      "category": "style",
      "title": "Finding 18",
      "evidence": "evidence 18",
      "impact": "impact 18",
      "suggestion": "suggestion 18",
      "introduced_by_pr": true,
      "source_agent": "generic-maintainability"
    },
    {
      "id": "cf-19",
      "path": "src/foo.ts",
      "line": 29,
      "side": "RIGHT",
      "severity": "low",
      "confidence": "medium",
      "category": "style",
      "title": "Finding 19",
      "evidence": "evidence 19",
      "impact": "impact 19",
      "suggestion": "suggestion 19",
      "introduced_by_pr": true,
      "source_agent": "generic-maintainability"
    },
    {
      "id": "cf-20",
      "path": "src/foo.ts",
      "line": 30,
      "side": "RIGHT",
      "severity": "low",
      "confidence": "medium",
      "category": "style",
      "title": "Finding 20",
      "evidence": "evidence 20",
      "impact": "impact 20",
      "suggestion": "suggestion 20",
      "introduced_by_pr": true,
      "source_agent": "generic-maintainability"
    },
    {
      "id": "cf-21",
      "path": "src/foo.ts",
      "line": 31,
      "side": "RIGHT",
      "severity": "low",
      "confidence": "medium",
      "category": "style",
      "title": "Finding 21",
      "evidence": "evidence 21",
      "impact": "impact 21",
      "suggestion": "suggestion 21",
      "introduced_by_pr": true,
      "source_agent": "generic-maintainability"
    },
    {
      "id": "cf-22",
      "path": "src/foo.ts",
      "line": 32,
      "side": "RIGHT",
      "severity": "low",
      "confidence": "medium",
      "category": "style",
      "title": "Finding 22",
      "evidence": "evidence 22",
      "impact": "impact 22",
      "suggestion": "suggestion 22",
      "introduced_by_pr": true,
      "source_agent": "generic-maintainability"
    },
    {
      "id": "cf-23",
      "path": "src/foo.ts",
      "line": 33,
      "side": "RIGHT",
      "severity": "low",
      "confidence": "medium",
      "category": "style",
      "title": "Finding 23",
      "evidence": "evidence 23",
      "impact": "impact 23",
      "suggestion": "suggestion 23",
      "introduced_by_pr": true,
      "source_agent": "generic-maintainability"
    },
    {
      "id": "cf-24",
      "path": "src/foo.ts",
      "line": 34,
      "side": "RIGHT",
      "severity": "low",
      "confidence": "medium",
      "category": "style",
      "title": "Finding 24",
      "evidence": "evidence 24",
      "impact": "impact 24",
      "suggestion": "suggestion 24",
      "introduced_by_pr": true,
      "source_agent": "generic-maintainability"
    },
    {
      "id": "cf-25",
      "path": "src/foo.ts",
      "line": 35,
      "side": "RIGHT",
      "severity": "low",
      "confidence": "medium",
      "category": "style",
      "title": "Finding 25",
      "evidence": "evidence 25",
      "impact": "impact 25",
      "suggestion": "suggestion 25",
      "introduced_by_pr": true,
      "source_agent": "generic-maintainability"
    },
    {
      "id": "cf-26",
      "path": "src/foo.ts",
      "line": 36,
      "side": "RIGHT",
      "severity": "low",